{
  "schemaVersion": 1,
  "title": "MODULES",
  "subtitle": "INTEGRITY",
  "statusBadge": {
    "text": "WAITING FOR DATA",
    "color": "dim"
  },
  "footerHint": "Awaiting ship telemetry...",
  "tabs": [
    {
      "id": "integrity",
      "title": "INTEGRITY",
      "type": "list",
      "items": [
        {
          "id": "placeholder",
          "label": "No module telemetry",
          "value": "—",
          "valueColor": "dim"
        }
      ]
    },
    {
      "id": "hull",
      "title": "HULL",
      "type": "keyvalue",
      "items": [
        {
          "id": "hull_status",
          "key": "Status",
          "value": "Awaiting Journal Loadout...",
          "valueColor": "dim"
        }
      ]
    }
  ]
}
