{
  "schemaVersion": 1,
  "title": "CARGO",
  "subtitle": "MANIFEST",
  "statusBadge": {
    "text": "WAITING FOR DATA",
    "color": "dim"
  },
  "footerHint": "Awaiting cargo inventory...",
  "tabs": [
    {
      "id": "inventory",
      "title": "INVENTORY",
      "type": "list",
      "items": [
        {
          "id": "placeholder",
          "label": "No cargo detected",
          "value": "—",
          "valueColor": "dim"
        }
      ]
    },
    {
      "id": "overview",
      "title": "OVERVIEW",
      "type": "keyvalue",
      "items": [
        {
          "id": "cargo_status",
          "key": "Status",
          "value": "Awaiting Cargo.json...",
          "valueColor": "dim"
        }
      ]
    },
    {
      "id": "capacity",
      "title": "CAPACITY",
      "type": "bars",
      "items": [
        {
          "id": "cargo_bar",
          "label": "Cargo Load",
          "value": 0,
          "max": 100,
          "color": "dim"
        }
      ]
    }
  ]
}
