{
  "$schema": "https://dmnemec.github.io/edvr-mfd/schema/display.v1.schema.json",
  "schemaVersion": 1,
  "title": "SHIP READOUT",
  "subtitle": "STANDBY",
  "statusBadge": {
    "text": "WAITING FOR DATA",
    "color": "dim"
  },
  "footerHint": "Awaiting ship telemetry...",
  "tabs": [
    {
      "id": "integrity",
      "title": "INTEGRITY",
      "type": "list",
      "items": [
        {
          "id": "placeholder",
          "label": "No module telemetry",
          "value": "—",
          "valueColor": "dim"
        }
      ]
    },
    {
      "id": "power",
      "title": "POWER",
      "type": "bars",
      "items": [
        {
          "id": "sys",
          "label": "SYS",
          "value": 0,
          "max": 8,
          "segments": 8,
          "color": "dim"
        },
        {
          "id": "eng",
          "label": "ENG",
          "value": 0,
          "max": 8,
          "segments": 8,
          "color": "dim"
        },
        {
          "id": "wep",
          "label": "WEP",
          "value": 0,
          "max": 8,
          "segments": 8,
          "color": "dim"
        }
      ]
    },
    {
      "id": "cargo",
      "title": "CARGO",
      "type": "list",
      "items": [
        {
          "id": "placeholder",
          "label": "No cargo detected",
          "value": "—",
          "valueColor": "dim"
        }
      ]
    }
  ]
}
