{
  "schemaVersion": 1,
  "title": "SYSTEM",
  "subtitle": "CARTOGRAPHY",
  "statusBadge": {
    "text": "WAITING FOR SCAN",
    "color": "dim"
  },
  "footerHint": "Awaiting system jump or scan telemetry...",
  "tabs": [
    {
      "id": "overview",
      "title": "OVERVIEW",
      "type": "keyvalue",
      "items": [
        {
          "id": "system_name",
          "key": "System",
          "value": "—",
          "valueColor": "dim"
        },
        {
          "id": "primary_star",
          "key": "Primary Star",
          "value": "—",
          "valueColor": "dim"
        },
        {
          "id": "allegiance",
          "key": "Allegiance",
          "value": "—",
          "valueColor": "dim"
        },
        {
          "id": "security",
          "key": "Security",
          "value": "—",
          "valueColor": "dim"
        },
        {
          "id": "population",
          "key": "Population",
          "value": "—",
          "valueColor": "dim"
        },
        {
          "id": "bodies_scanned",
          "key": "Bodies",
          "value": "Bodies scanned: 0 / 0",
          "valueColor": "dim"
        },
        {
          "id": "system_value",
          "key": "Estimated Value",
          "value": "0 CR",
          "valueColor": "dim"
        }
      ]
    },
    {
      "id": "bodies",
      "title": "BODIES",
      "type": "list",
      "items": [
        {
          "id": "placeholder_bodies",
          "label": "No bodies scanned",
          "sublabel": "Honk system to begin survey",
          "value": "—",
          "valueColor": "dim"
        }
      ]
    }
  ]
}
